{
  "kind": "frameshift.analysis",
  "schemaVersion": 1,
  "engineVersion": "@ENGINE_VERSION@",
  "ruleset": "nextjs-to-astro-preact/assessment-v1",
  "knowledgeBase": "2026.10.1",
  "targetProfile": "astro7-preact10",
  "weights": "weights-v1",
  "source": {
    "adapter": "nextjs",
    "version": "16.2.0",
    "package": "."
  },
  "target": "astro-preact",
  "limits": [
    {
      "name": "analysis.max-dependency-work",
      "value": 16777216
    },
    {
      "name": "analysis.max-occurrences",
      "value": 100000
    },
    {
      "name": "analysis.max-report-bytes",
      "value": 67108864
    },
    {
      "name": "analysis.max-units",
      "value": 100000
    },
    {
      "name": "css.max-tokens",
      "value": 4194304
    },
    {
      "name": "css.parser.max-depth",
      "value": 128
    },
    {
      "name": "css.parser.max-diagnostics",
      "value": 256
    },
    {
      "name": "css.parser.max-nodes",
      "value": 4194304
    },
    {
      "name": "css.parser.max-work",
      "value": 16777216
    },
    {
      "name": "edit.max-edits",
      "value": 100000
    },
    {
      "name": "edit.max-output-bytes",
      "value": 67108864
    },
    {
      "name": "emit.max-depth",
      "value": 256
    },
    {
      "name": "emit.max-output-bytes",
      "value": 67108864
    },
    {
      "name": "evaluate.max-depth",
      "value": 64
    },
    {
      "name": "evaluate.max-value-size",
      "value": 1048576
    },
    {
      "name": "evaluate.max-work",
      "value": 16777216
    },
    {
      "name": "finding.max-findings",
      "value": 100000
    },
    {
      "name": "finding.max-text-bytes",
      "value": 65536
    },
    {
      "name": "hash.max-bytes",
      "value": 2305843009213693951
    },
    {
      "name": "identifier.max-bytes",
      "value": 131072
    },
    {
      "name": "ignore.max-match-work",
      "value": 17179869184
    },
    {
      "name": "ignore.max-total-bytes",
      "value": 4194304
    },
    {
      "name": "json.max-depth",
      "value": 256
    },
    {
      "name": "json.max-nodes",
      "value": 4194304
    },
    {
      "name": "modules.max-config-depth",
      "value": 32
    },
    {
      "name": "modules.max-edges",
      "value": 1000000
    },
    {
      "name": "modules.max-files",
      "value": 100000
    },
    {
      "name": "modules.max-work",
      "value": 268435456
    },
    {
      "name": "package.max-lockfile-bytes",
      "value": 67108864
    },
    {
      "name": "parse.lexical.max-comments",
      "value": 100000
    },
    {
      "name": "parse.lexical.max-identifier-bytes",
      "value": 1048576
    },
    {
      "name": "parse.lexical.max-jsx-text-bytes",
      "value": 1048576
    },
    {
      "name": "parse.lexical.max-number-bytes",
      "value": 1048576
    },
    {
      "name": "parse.lexical.max-regexp-bytes",
      "value": 1048576
    },
    {
      "name": "parse.lexical.max-string-bytes",
      "value": 1048576
    },
    {
      "name": "parse.lexical.max-template-bytes",
      "value": 1048576
    },
    {
      "name": "parse.max-nesting-depth",
      "value": 256
    },
    {
      "name": "parse.max-nodes",
      "value": 100000
    },
    {
      "name": "parse.max-tokens",
      "value": 200000
    },
    {
      "name": "parse.recovery.max-diagnostics",
      "value": 256
    },
    {
      "name": "parse.recovery.max-work",
      "value": 1048576
    },
    {
      "name": "path.max-components",
      "value": 256
    },
    {
      "name": "path.max-path-bytes",
      "value": 32768
    },
    {
      "name": "run.max-directory-depth",
      "value": 255
    },
    {
      "name": "run.max-entries",
      "value": 1000000
    },
    {
      "name": "run.max-file-bytes",
      "value": 67108864
    },
    {
      "name": "run.max-files",
      "value": 100000
    },
    {
      "name": "run.max-total-bytes",
      "value": 1073741824
    },
    {
      "name": "sass.max-depth",
      "value": 128
    },
    {
      "name": "sass.max-nodes",
      "value": 1000000
    },
    {
      "name": "sass.max-work",
      "value": 16777216
    },
    {
      "name": "text.max-source-bytes",
      "value": 16777216
    },
    {
      "name": "workspace.max-alternatives",
      "value": 256
    },
    {
      "name": "workspace.max-match-work",
      "value": 100000000
    },
    {
      "name": "workspace.max-pattern-bytes",
      "value": 4096
    },
    {
      "name": "workspace.max-patterns",
      "value": 1024
    },
    {
      "name": "yaml.max-depth",
      "value": 128
    },
    {
      "name": "yaml.max-nodes",
      "value": 4194304
    },
    {
      "name": "yarn.max-depth",
      "value": 64
    },
    {
      "name": "yarn.max-nodes",
      "value": 4194304
    }
  ],
  "summary": {
    "verdict": "Good candidate with manual work: recognized features block the listed routes; review all unknown evidence.",
    "evidence": [
      "F0001",
      "F0002",
      "F0003"
    ],
    "unitCount": 8,
    "totalWeight": 34,
    "distribution": [
      {
        "status": "auto",
        "count": 6,
        "metric": {
          "numerator": 24,
          "denominator": 34,
          "basisPoints": 7058
        }
      },
      {
        "status": "review",
        "count": 1,
        "metric": {
          "numerator": 2,
          "denominator": 34,
          "basisPoints": 588
        }
      },
      {
        "status": "unknown",
        "count": 0,
        "metric": {
          "numerator": 0,
          "denominator": 34,
          "basisPoints": 0
        }
      },
      {
        "status": "unsupported",
        "count": 1,
        "metric": {
          "numerator": 8,
          "denominator": 34,
          "basisPoints": 2352
        }
      }
    ],
    "unweightedDistribution": [
      {
        "status": "auto",
        "count": 6,
        "metric": {
          "numerator": 6,
          "denominator": 8,
          "basisPoints": 7500
        }
      },
      {
        "status": "review",
        "count": 1,
        "metric": {
          "numerator": 1,
          "denominator": 8,
          "basisPoints": 1250
        }
      },
      {
        "status": "unknown",
        "count": 0,
        "metric": {
          "numerator": 0,
          "denominator": 8,
          "basisPoints": 0
        }
      },
      {
        "status": "unsupported",
        "count": 1,
        "metric": {
          "numerator": 1,
          "denominator": 8,
          "basisPoints": 1250
        }
      }
    ],
    "analysisCoverage": {
      "numerator": 34,
      "denominator": 34,
      "basisPoints": 10000
    },
    "automaticFeasibility": {
      "numerator": 24,
      "denominator": 34,
      "basisPoints": 7058
    },
    "feasibilityWithReview": {
      "numerator": 26,
      "denominator": 34,
      "basisPoints": 7647
    },
    "ruleCoverage": {
      "numerator": 0,
      "denominator": 14,
      "basisPoints": 0
    },
    "routeReadiness": [
      {
        "status": "auto",
        "count": 0
      },
      {
        "status": "review",
        "count": 1
      },
      {
        "status": "unknown",
        "count": 0
      },
      {
        "status": "unsupported",
        "count": 1
      }
    ]
  },
  "routes": [
    {
      "pattern": "/",
      "unit": "route:/",
      "status": "review",
      "closure": [
        "component:counter.tsx#Counter",
        "config:nextjs.project.app-router",
        "config:npm.manifest",
        "config:source.analysis",
        "layout:app/layout.tsx",
        "module:counter.tsx",
        "route:/"
      ],
      "blocker": null,
      "dependencyPath": [],
      "outputPath": null
    },
    {
      "pattern": "/private",
      "unit": "route:/private",
      "status": "unsupported",
      "closure": [
        "config:nextjs.project.app-router",
        "config:npm.manifest",
        "config:source.analysis",
        "layout:app/layout.tsx",
        "route:/private"
      ],
      "blocker": "route:/private",
      "dependencyPath": [
        "app/private/page.tsx"
      ],
      "outputPath": null
    }
  ],
  "units": [
    {
      "id": "component:counter.tsx#Counter",
      "kind": "component",
      "path": "counter.tsx",
      "ranges": [
        {
          "start": 59,
          "end": 171
        }
      ],
      "client": true,
      "weight": 5,
      "status": "auto",
      "strategy": "island",
      "outcome": "not-run",
      "verification": [],
      "findings": []
    },
    {
      "id": "config:nextjs.project.app-router",
      "kind": "config",
      "path": "app",
      "ranges": [],
      "client": false,
      "weight": 2,
      "status": "auto",
      "strategy": "not-applicable",
      "outcome": "not-run",
      "verification": [],
      "findings": []
    },
    {
      "id": "config:npm.manifest",
      "kind": "config",
      "path": "package.json",
      "ranges": [],
      "client": false,
      "weight": 2,
      "status": "auto",
      "strategy": "not-applicable",
      "outcome": "not-run",
      "verification": [],
      "findings": []
    },
    {
      "id": "config:source.analysis",
      "kind": "config",
      "path": null,
      "ranges": [],
      "client": false,
      "weight": 2,
      "status": "review",
      "strategy": "not-applicable",
      "outcome": "not-run",
      "verification": [],
      "findings": [
        "F0002"
      ]
    },
    {
      "id": "layout:app/layout.tsx",
      "kind": "layout",
      "path": "app/layout.tsx",
      "ranges": [],
      "client": false,
      "weight": 5,
      "status": "auto",
      "strategy": "astro",
      "outcome": "not-run",
      "verification": [],
      "findings": []
    },
    {
      "id": "module:counter.tsx",
      "kind": "module",
      "path": "counter.tsx",
      "ranges": [
        {
          "start": 0,
          "end": 59
        }
      ],
      "client": true,
      "weight": 2,
      "status": "auto",